<?xml version="1.0" encoding="utf-8"?>
<xs:schema xmlns:xs="http://www.w3.org/2001/XMLSchema">
    <xs:element name="tickets">
        <xs:complexType>
            <xs:sequence>
                <xs:element name="ticket" minOccurs="0" maxOccurs="unbounded">
                    <xs:complexType>
                        <xs:sequence>
                            <xs:element name="issuedate" type="xs:dateTime"></xs:element>
                            <xs:element name="subject" type="xs:string"></xs:element>
                            <xs:element name="message" minOccurs="1" maxOccurs="unbounded">
                                <xs:complexType>
                                    <xs:simpleContent>
                                        <xs:extension base="xs:string">
                                            <xs:attribute name="timestamp" type="xs:dateTime"></xs:attribute>
                                            <xs:attribute name="sentby_userid" type="xs:positiveInteger"></xs:attribute>
                                        </xs:extension>
                                    </xs:simpleContent>
                                </xs:complexType>
                            </xs:element>
                        </xs:sequence>
                        <xs:attribute name="id" type="xs:positiveInteger"></xs:attribute>
                        <xs:attribute name="status" type="xs:string"></xs:attribute>
                        <xs:attribute name="initiatedbyuserid" type="xs:positiveInteger"></xs:attribute>
                    </xs:complexType>
                </xs:element>
            </xs:sequence>
        </xs:complexType>
    </xs:element>
</xs:schema>